<?xml version="1.0" encoding="UTF-8"?>
<deal xmlns:xsi="http://www.w3.org/2001/XMLSchema-instance" xsi:noNamespaceSchemaLocation="../xsds/dealprocessing.xsd">
  <id>0</id>
  <descrption>descrption</descrption>
  <startDate>2001-12-31T12:00:00</startDate>
  <maturityDate>2001-12-31T12:00:00</maturityDate>
  <facilityList>
    <amount>0.0</amount>
    <drawDownList/>
    <id>0</id>
    <maturityDate>2001-12-31T12:00:00</maturityDate>
    <startDate>2001-12-31T12:00:00</startDate>
  </facilityList>
</deal>
